area,habilidade,descricao,tri_score
Humanas,H24,"Ditadura Militar no Brasil (AI-2): A charge sobre o ""cemitério dos partidos"" referindo-se à adoção do bipartidarismo regulado pelo Ato Institucional nº 2.",708.0
Humanas,H24,Cidadania e Violência no Brasil: A dificuldade histórica da sociedade brasileira em institucionalizar formas de controle social compatíveis com valores democráticos.,795.0
Humanas,H25,Pan-africanismo/Poesia: O poema de Agostinho Neto conclamando as populações negras de diferentes países a apoiar as lutas por igualdade e independência.,503.5
Humanas,H25,Trabalho Escravo Contemporâneo: A estratégia de articular os órgãos públicos para reduzir o problema.,532.5
Humanas,H25,Democracia Deliberativa (Habermas): A condição para a inclusão social através do debate livre e racional entre cidadãos e Estado.,539.6
Humanas,H25,Educação no Brasil (Manifesto dos Pioneiros): A proposta de uma relação necessária entre acesso à escola e valorização do mérito (hierarquia das capacidades).,557.7
Humanas,H25,Relações Étnico-Raciais na Educação: A Lei 10.639/03 associando a inclusão social a práticas de valorização identitária.,568.9
Humanas,H25,"Movimento Feminista: O comportamento da personagem, que busca uma educação masculina, evidencia uma ruptura de valores institucionalizados sobre o papel da mulher.",579.1
Humanas,H25,"Democracia Deliberativa vs. Ativista: As concepções se baseiam, respectivamente, na obtenção do consenso e na mobilização das minorias.",591.7
Humanas,H25,Fim do Apartheid (África do Sul): A consolidação da democracia na África do Sul relacionada à superação do legado segregacionista.,597.9
Humanas,H25,"Movimento Abolicionista: As práticas culturais narradas (oratória, poesia, compra de alforrias) remetendo ao movimento abolicionista.",599.6
Humanas,H25,Educação Inclusiva (Declaração de Salamanca): O compromisso do Brasil com políticas educacionais que contemplem a pluralidade dos sujeitos.,602.9
Humanas,H25,Cartografia Social: O projeto de ensinar GPS a grupos tradicionais como forma de valorização de identidades coletivas (mapeamento de suas terras).,611.4
Humanas,H25,"Direitos Culturais das Minorias (Habermas): A coexistência das diferenças, permitindo que os discursos se submetam ao debate público e ao melhor argumento.",662.1
Humanas,H25,"Movimentos de Trabalhadores (Brasil Império): A atuação dos caixeiros, ao se organizarem e exigirem direitos, como contestação dos princípios monárquicos e da ordem vigente.",708.5
Humanas,H26,Função Social da Cidade: A qualificação de serviços públicos em bairros periféricos como política para viabilizar a função social da cidade.,487.8
Humanas,H26,"Ocupação Urbana e Meio Ambiente: A aglomeração urbana em mangues (mocambos) e a interferência no espaço geográfico (poluição, degradação).",508.1
Humanas,H26,Relação Sociedade-Natureza: O poema de Cora Coralina valorizando a relação entre camponeses e o uso da natureza.,522.5
Humanas,H26,Saberes Tradicionais/Meio Ambiente: A relação socioespacial dos indígenas Xavante com o Cerrado evidenciando a importância do saber tradicional para a conservação ambiental.,530.0
Humanas,H26,Colonização da América: O interesse econômico espanhol (ouro) e a fundação de cidades para controlar a circulação de riquezas.,551.8
Humanas,H26,Biomas Brasileiros: A descrição da paisagem no texto de Euclides da Cunha correspondendo à composição de vegetação xerófila (Caatinga).,553.2
Humanas,H26,Geografia Física (Movimentos da Terra): A diferença de horário (dia/noite) entre EUA e França causada pelo movimento de rotação da Terra.,564.5
Humanas,H26,Relação Sociedade-Natureza: As posturas de idealização (poema) e mercantilização (ecoturismo) em relação à natureza.,577.1
Humanas,H26,Geologia/Tectônica de Placas: A formação da Cordilheira do Himalaia como resultado do encontro de placas tectônicas.,582.1
Humanas,H26,Ciclo Hidrológico: A maior cobertura vegetal intensificando o processo de recarga dos aquíferos (infiltração).,592.5
Humanas,H26,Riscos Naturais/Ocupação Humana: A fixação do homem em zonas de risco vulcânico justificada pela ocorrência de solo fértil.,599.4
Humanas,H26,"Geografia Física/Clima: O fenômeno da ""noite polar"" no Alasca condicionado pela alta latitude da cidade.",602.6
Humanas,H26,"História Medieval/Vida Urbana: O impacto dos incêndios nas cidades medievais, proporcionando a reconfiguração dos espaços ocupados e das dinâmicas comunitárias.",617.2
Humanas,H26,Geologia/Terremotos: O fenômeno dos terremotos ocorrendo em áreas de alívio da tensão geológica (limites de placas).,622.7
Humanas,H26,"Cultura Sertaneja/Clima: O experimento de Santa Luzia como exemplo do sertanejo íntimo à Caatinga, interpretando condições ambientais.",634.9
Humanas,H26,Urbanização e Hidrologia: A ampliação do escoamento superficial como consequência da urbanização.,645.1
Humanas,H26,Imperialismo/Geografia: A exaltação da ciência geográfica no século XIX decorrente do seu uso para a catalogação de dados úteis aos propósitos colonialistas.,651.1
Humanas,H26,"Mobilidade Urbana: A proposta de ""casas móveis"" afetaria a dinâmica urbana ao reduzir a intensidade do movimento pendular.",669.5
Humanas,H26,Geomorfologia/Movimentos de Massa: A ocorrência de movimentos de massa é minimizada em locais com drenagem eficiente.,675.4
Humanas,H26,Climatologia/Brasil: O fator determinante para os índices de umidade relativa do ar no Nordeste e Sul sendo as massas de ar.,683.5
Humanas,H27,Poluição Hídrica (Rio Tietê): A condição do rio tem como origem a recepção de densa carga de dejetos (esgoto).,510.9
Humanas,H27,Questão Indígena e Ambiental: O discurso da líder indígena Txai Suruí sobre um problema global relacionado à exploração predatória.,531.8
Humanas,H27,"Relação Sociedade-Natureza: A mudança na relação com a natureza, da visão de domínio (Bacon) à percepção de desequilíbrio (Guimarães), caracterizada pela objetificação do espaço físico.",534.5
Humanas,H27,"Saberes Tradicionais: O conhecimento do sertanejo para prever o tempo, constituído pela experiência perceptiva.",536.9
Humanas,H27,Brasil Colônia/Medicina: A importância da medicina justificada no âmbito dos objetivos econômicos das elites (manter a mão de obra escrava).,541.1
Humanas,H27,Clima/Sociedade: Uma sociedade se torna mais vulnerável à variação climática quando concentra suas atividades no setor primário.,558.9
Humanas,H27,Agronegócio/Agrotóxicos: A charge como crítica ao uso de agrotóxicos nas plantações.,560.9
Humanas,H27,"Crítica Ambiental (Brasil, séc. XVIII-XIX): Os críticos viam o meio natural como ferramenta essencial para o avanço da nação, e sua destruição como sinal de atraso.",561.6
Humanas,H27,Cartografia/Coordenadas Geográficas: A confusão da personagem Alice relacionada aos referenciais de posição relativa (latitude e longitude).,576.8
Humanas,H27,Meio Ambiente/Pesca: O problema da sobrepesca do bacalhau relacionando-se à insustentabilidade do modelo de produção e consumo.,580.1
Humanas,H27,"Desertificação (África): O projeto da ""Grande Muralha Verde"" como forma de evitar a expansão da desertificação no Sahel.",582.8
Humanas,H27,Urbanização Brasileira: A expansão das áreas periféricas como consequência do crescimento da população urbana e do aumento da especulação imobiliária.,602.8
Humanas,H27,Antropoceno: A nova época geológica concebida a partir da influência humana nos processos exógenos (que atuam na superfície).,610.8
Humanas,H27,História da Medicina no Brasil Colonial: A prática medicinal descrita caracterizada pela conjugação de saberes empíricos (europeu e indígena).,612.5
Humanas,H27,Agricultura Urbana: A vantagem da agricultura urbana na ocupação de lugares ociosos.,619.4
Humanas,H27,Meio Ambiente/Degradação: O processo de perda de produtividade de biomas descrito no texto refere-se à desertificação de ecossistemas.,631.0
Humanas,H27,Ocupação da Amazônia: A pesquisa que mostra a dominância de espécies domesticadas rompendo com a ideia de ausência de ação antrópica na floresta.,639.5
Humanas,H27,Mulheres na Ciência (Séc. XIX): A relação das mulheres com a ciência representativa da incorporação das estratificações sociais (papel de esposas coloniais).,657.0
Humanas,H27,Ocupação da Amazônia (Ferrovia Madeira-Mamoré): Crítica à contradição entre o desenvolvimento nacional (progresso) e o respeito aos trabalhadores (vítimas).,659.3
Humanas,H27,Urbanização/Segregação (Séc. XIX): A consequência geográfica da especialização dos bairros sendo a ampliação do tempo de deslocamento diário da população.,730.2
Humanas,H27,Questão Agrária na África: A concentração de terras no setor agroexportador e o aumento da ocupação de populações pobres em territórios marginais.,756.7
Humanas,H28,Degradação do Solo: O que impede a recuperação do solo é a diminuição da fertilidade.,524.1
Humanas,H28,Degradação do Solo: A dinâmica ambiental de empobrecimento químico e lixiviação gera a elevação da acidez do solo agricultável.,555.2
Humanas,H28,Poluição/Transportes: O impacto do setor de transportes (derretimento das calotas polares) e uma medida para reduzi-lo (incentivo aos transportes de massa).,602.9
Humanas,H28,Energia Eólica: A instalação do complexo eólico na Bahia como expansão das fontes renováveis no sistema energético brasileiro.,603.1
Humanas,H28,Recurso Hídrico/Dessalinização: A concentração de usinas de dessalinização em áreas como Oriente Médio e norte da África explicada pela escassez de água potável.,604.4
Humanas,H28,Sensoriamento Remoto: A geração de imagens de satélite depende da variação do albedo (refletividade) dos corpos físicos.,634.7
Humanas,H28,"Bioética/Tecnologia: O ""princípio da precaução"" como forma de instituir o diálogo público sobre mudanças tecnológicas e suas consequências.",654.5
Humanas,H28,Lixo Eletrônico/Globalização: A exportação de lixo eletrônico para países pobres reflete um padrão da Divisão Internacional do Trabalho.,667.8
Humanas,H28,"Intervenção no Espaço (Usinas Hidrelétricas): A imagem de barragens indica a ampliação da capacidade de geração de energia, com alteração do ecossistema local.",690.5
Humanas,H28,"Extrativismo Vegetal vs. Silvicultura: A variação das curvas (queda do extrativismo, alta da silvicultura) influenciada pela utilização de madeira de reflorestamento.",704.8
Humanas,H28,Salinização do Solo: As atividades agrícolas no semiárido intensificam a salinização ao utilizar sistemas de irrigação sem drenagem adequada.,734.0
Humanas,H28,Colonização da Amazônia: O primeiro eixo de ocupação (Leste-Oeste) demonstra um padrão de povoados interligados próximos a grandes rios.,764.0
Humanas,H29,Uso da Água: A ampliação de sistemas de reutilização hídrica como estratégia para alterar a lógica de aumento do consumo de água.,470.5
Humanas,H29,"História Ambiental (Europa): O processo de expansão marítima (construção naval, etc.) como fator que agravou a ""crise florestal"" na Europa dos séculos XV e XVI.",571.0
Humanas,H29,Chuva Ácida: A redução da flora como consequência direta do problema da chuva ácida.,577.5
Humanas,H29,Segurança Hídrica: A proposta de preços justos e autorizações de uso da água pautada na distribuição equitativa do abastecimento.,578.4
Humanas,H29,História Islâmica/Urbanização: A escolha do local para construir Bagdá orientada pela disponibilidade de rotas e terras férteis como base da dominação política.,594.7
Humanas,H29,"Geopolítica (Mar da China Meridional): O conflito entre China, Vietnã e Filipinas tendo como foco a jurisdição da soberania territorial para exploração de recursos.",601.9
Humanas,H29,Geologia do Brasil: As estruturas de escudos cristalinos (Guianas e Brasileiro) são importantes economicamente por concentrarem jazidas de minerais metálicos.,605.1
Humanas,H29,"Geologia do Brasil/Recursos Minerais: As regiões cratônicas (escudos) apresentando áreas de intrusões graníticas ricas em jazidas minerais (ferro, manganês).",608.2
Humanas,H29,História do Brasil/Obras contra a Seca: A construção do Açude Itans destacando a presença de trabalhadores na formação de novos espaços.,632.0
Humanas,H29,"Bioma Cerrado/Hidrografia: As veredas constituindo um sistema represador da água na chapada, fundamental para o equilíbrio hidrológico.",639.3
Humanas,H29,Geologia/Tectônica de Placas: A colisão entre placa continental e oceânica (subducção) gerando a feição fisiográfica dos dobramentos modernos (cordilheiras).,656.4
Humanas,H29,"Melhoramento Genético na Agricultura: As técnicas de melhoramento de uvas buscando adaptar o cultivo aos elementos ambientais singulares de cada região (semiárido, Serra Gaúcha).",662.0
Humanas,H29,Crise Hídrica no Sudeste (2014): A causa natural da seca foi a formação de um anticiclone (bloqueio atmosférico) impedindo a entrada de umidade.,666.0
Humanas,H29,Expansão Ferroviária (Primeira República): A nova orientação da expansão ferroviária para o interior tinha como objetivo a valorização de regiões de baixa densidade demográfica (povoamento).,669.6
Humanas,H29,Biomas Brasileiros/Modernização Agrícola: O processo de modernização e desmatamento descrito ocorre em uma área com predomínio de vegetação tropófila e clima tropical (Cerrado).,680.3
Humanas,H29,"Clima Amazônico: O mecanismo climático da convecção na Amazônia associado à convergência de fluxos de ar (rios voadores, umidade).",696.0
Humanas,H29,"Desastre Ambiental (Mar de Aral): A intensa interferência humana (desvio de rios para irrigação) provocou a salinização da área, criando um deserto.",804.4
Humanas,H30,Mudanças Climáticas: O controle das emissões de carbono como medida para minimizar as mudanças apresentadas nas simulações.,494.4
Humanas,H30,Sistemas Agroflorestais: A prática produtiva da cabruca (cacau à sombra) como exemplo de utilização sustentável dos recursos naturais.,512.9
Humanas,H30,Agrotóxicos e Polinizadores: A utilização da técnica de controle biológico como solução para garantir a produtividade agrícola sem exterminar as abelhas.,544.1
Humanas,H30,"Urbanização/Impactos Ambientais: A intensificação da ocupação urbana (impermeabilização, etc.) afeta de forma imediata o ciclo hidrológico.",559.1
Humanas,H30,Conservação do Solo: O método de cultivo em curvas de nível (terraceamento) tem como objetivo controlar a erosão laminar.,575.7
Humanas,H30,"Geologia/Ciclo das Rochas: As transformações na superfície terrestre (destruição, transporte, deposição) compõem o ciclo sedimentar.",586.6
Humanas,H30,Tectônica de Placas: Os terremotos descritos no Chile estão concentrados em estreitas faixas de intensidade sísmica no contato das placas tectônicas.,587.8
Humanas,H30,Irrigação/Impactos Socioambientais: As técnicas de irrigação no Brasil produziram como impacto o agravamento da poluição hídrica.,600.0
Humanas,H30,Agricultura e Recursos Hídricos: A expansão da agricultura demanda melhorias na eficiência das técnicas de irrigação para reduzir a pressão sobre a água.,600.1
Humanas,H30,Problemas Ambientais (Biomas Brasileiros): O problema ambiental destacado no mapa (área do semiárido nordestino) é a desertificação das áreas afetadas.,604.3
Humanas,H30,Mineração/Conflitos Socioambientais: A relação entre atividade mineradora e organização social marcada pelo rompimento de vínculos locais das comunidades afetadas.,621.0
Humanas,H30,Concepções Ambientais: A concepção de preservação ambiental descrita no texto está baseada na proibição permanente da exploração da natureza.,633.5
Humanas,H30,Biodiversidade/Hotspots (Cerrado): A necessidade de ações no Cerrado tem como causa a expansão da fronteira agrícola.,633.8
Humanas,H30,Protocolo de Quioto/Créditos de Carbono: As posições contrárias à comercialização de créditos de carbono relacionam-se à ideia de que ela promove desigualdade na distribuição do impacto ecológico.,651.8
Humanas,H30,Conhecimento Científico vs. Tradicional: A necessidade de reconstrução do modelo científico de caça sustentável foi determinada pelo confronto com um conhecimento empírico apropriado pelo senso comum (modelo dos seringueiros).,701.0
Humanas,H30,Aquífero Guarani: A preservação do Aquífero Guarani pressupõe a introdução da gestão participativa entre os municípios que o utilizam.,730.3
Humanas,H30,"Formação de Solos (Laterização): O tipo climático que favorece o processo de laterização (formação de canga) é o tropical, com sazonalidade das chuvas.",755.4
Humanas,H30,"Geologia/Rifteamento: Os aspectos físicos da Islândia (vulcões, separação de placas) originam-se da atuação da força natural de rifteamento da crosta terrestre.",822.9
Humanas,H21,Tecnologia e Sociedade: O papel da Internet como novo meio de comunicação e democratização da informação.,373.2
Humanas,H26,Meio Ambiente/Saúde Pública: Os lixões como locais propícios à proliferação de vetores de doenças e contaminação do solo e água.,459.5
Humanas,H18,Modos de Produção: O artesanato se caracterizando pelo trabalho geralmente sem máquinas e de modo diferente da produção em série.,472.0
Humanas,H2,"Crítica Historiográfica: A crítica de Bertolt Brecht ao fato de que monumentos foram construídos por trabalhadores, mas a memória está vinculada aos governantes.",516.0
Humanas,H23,"Ética e Cidadania: A ética como instrumento de garantia da cidadania, através da qual os cidadãos agem segundo valores coletivos.",529.2
Humanas,H16,Mídia e Política no Brasil: A TV revelando casos de corrupção como exemplo de sua utilidade pública a favor da democracia.,531.4
Humanas,H17,Revolução Industrial/Urbanização: O alto nível de exploração dos trabalhadores ocasionando o surgimento de aglomerados urbanos com péssimas condições de moradia.,532.5
Humanas,H22,"MPB e Ditadura Militar: O papel da música ""Opinião"" como denúncia da situação social e política do país em 1964.",543.4
Humanas,H9,Blocos Econômicos (BRIC): O termo BRIC referindo-se a países com características econômicas promissoras para as próximas décadas.,548.5
Humanas,H20,Tecnologia e Trabalho: A automação bancária como exemplo da diminuição dos custos para as empresas e da insegurança no emprego para os trabalhadores.,550.8
Humanas,H22,Revolução Industrial/Luta de Classes: A contradição de que a riqueza não era usufruída por aqueles que a produziam.,559.5
Humanas,H12,Ditadura no Chile: A subordinação do poder judiciário aos interesses políticos dominantes durante a ditadura.,577.0
Humanas,H3,"Homofobia no Brasil: A associação entre as condenações históricas à homossexualidade e a violência contemporânea, marcadas por tabus e intolerância.",595.5
Humanas,H12,Filosofia Política (Maquiavel): A manutenção da ordem social baseada na conveniência entre o poder tirânico e a moral do príncipe.,596.5
Humanas,H23,Ética Contemporânea: A compreensão do sentido coletivo e político das ações humanas individuais.,600.3
Humanas,H14,Teoria Política/Democracia: O elemento comum entre o autoritarismo excludente e a democracia incompleta sendo o controle das decisões por uma minoria.,601.4
Humanas,H10,Revolução Francesa (Jacobinos): O discurso de Robespierre representando os interesses da pequena e média burguesia e das camadas populares (sans-culottes) que desejavam justiça social.,602.5
Humanas,H6,Estrutura Fundiária no Brasil: O gráfico evidenciando a concentração de terras nas mãos de poucos (latifúndios).,604.3
Humanas,H22,"Era Vargas/Direitos Trabalhistas: A legislação trabalhista que atendeu reivindicações dos operários, garantindo-lhes direitos e proteção.",608.3
Humanas,H18,Questão Indígena/Agronegócio: A tensão entre a expansão territorial do agronegócio no Centro-Oeste e Norte e as leis de proteção indígena e ambiental.,610.4
Humanas,H25,Abolicionismo no Brasil: A biografia de Luiz Gama exemplificando a extrema dificuldade de projeção dos intelectuais negros e o uso do Direito como canal de luta pela liberdade.,610.9
Humanas,H11,Civilização Inca: A principal característica da sociedade inca era a impossibilidade de mobilidade social e a existência de uma aristocracia hereditária.,619.3
Humanas,H1,Brasil República/Capoeira: A criminalização da capoeiragem como expressão da criminalização de práticas culturais e da persistência de valores que vinculavam negros ao passado escravista.,622.8
Humanas,H19,Modernização do Campo no Brasil: O aumento do aproveitamento de solos menos férteis como consequência da modernização.,623.4
Humanas,H17,"Modernização da Agricultura Brasileira: O fenômeno de ""exportação de trabalhadores"" como consequência dos impactos sociais da modernização agrícola (concentração de terras, desemprego).",626.0
Humanas,H26,Erosão/Impactos Urbanos: A maior ocorrência de enchentes devido ao assoreamento dos rios como reflexo da erosão nas encostas.,628.1
Humanas,H1,Brasil (Período Joanino): O projeto industrializante de D. João não se concretizou devido à dependência de Portugal em relação à Inglaterra e ao predomínio industrial inglês.,631.7
Humanas,H15,Crise Pré-1964 no Brasil: Os conflitos sociais do início dos anos 1960 decorreram das contradições econômicas do modelo desenvolvimentista de JK.,643.0
Humanas,H16,Cartografia/Coordenadas Geográficas: A definição de coordenadas geográficas como um conjunto de linhas imaginárias (latitude e longitude) que permitem localizar um ponto na superfície.,645.9
Humanas,H27,Erosão/Práticas Agrícolas: A aração do solo do topo ao vale (morro abaixo) como prática que acelera o processo de erosão.,646.2
Humanas,H24,"Democracia e Despotismo: A ""vacina"" contra o despotismo seria evitar a escolha de governantes autoritários.",672.5
Humanas,H5,Cultura e Alimentação (Brasil Colônia): A criação do feijão tropeiro relacionada à atividade mercantil dos homens que transportavam gado e mercadorias.,682.3
Humanas,H30,"Geologia/Fósseis: Os fósseis são encontrados em rochas sedimentares, pois os restos podem ter sido soterrados e litificados com os sedimentos.",693.5
Humanas,H29,"Logística e Recursos Minerais (Brasil): A importância da Estrada de Ferro Carajás para a logística do setor primário, ligada à capacidade de produção de minerais metálicos na região.",695.4
Humanas,H8,"Anexação do Acre ao Brasil: A anexação do Acre devido à crescente emigração de brasileiros que exploravam os seringais, levando a um conflito resolvido pelo Tratado de Petrópolis.",701.4
Humanas,H4,Construção de Heróis Nacionais (Tiradentes): A transformação de Tiradentes em herói nacional pelo fato de a Proclamação da República ter poucas raízes populares e precisar de legitimação simbólica.,723.2
Humanas,H29,Usina de Belo Monte/Impactos: Os impasses e resistências associados à necessidade de equilibrar o investimento no crescimento do país com os esforços de conservação ambiental.,725.6
Humanas,H28,"Movimentos Sociais/Meio Ambiente (Luddismos): Os movimentos sociais (luddistas, ambientalistas) emergindo da contestação à degradação do trabalho, das tradições e da natureza.",737.8
Humanas,H24,Filosofia Política (Foucault): A finalidade das leis é organizar as relações de poder na sociedade e entre os Estados.,769.6
Humanas,H28,"Guerra do Contestado/Impactos Sociais: A desorganização da economia tradicional (erva-mate, etc.) que sustentava os posseiros e trabalhadores rurais da região.",775.2
Humanas,H13,Crise do Império/Período Regencial: O contexto marcado pela convulsão política e por novas realidades econômicas que exigiam o reforço de velhas realidades sociais (escravidão).,782.8
Humanas,H11,Cultura Tupi-Guarani: A ritualização da guerra entre as tribos e o caráter semissedentário de sua organização social.,812.9
Humanas,H7,Período Joanino no Brasil: Uma das consequências foi a conquista da região do rio da Prata (Cisplatina) em represália à aliança entre Espanha e França.,812.9
Humanas,H14,Guerra do Paraguai (Historiografia): As narrativas divergentes demonstram a dificuldade de elaborar explicações convincentes sobre os motivos da guerra.,812.9
Humanas,H5,"Patrimônio Cultural (Canudos): As ruínas de Canudos, como patrimônio material, reúnem um conjunto de objetos arqueológicos e paisagísticos.",812.9
Natureza,H1,Física/Ondulatória: A contribuição de Galileu para o estudo de cordas vibrantes.,412.7
Natureza,H1,Física: Evolução dos modelos cosmológicos (geocentrismo x heliocentrismo).,473.0
Natureza,H1,Biologia/Genética: A descoberta da estrutura do DNA e o reconhecimento do trabalho de Rosalind Franklin.,549.4
Natureza,H1,Química: A Lei da Conservação das Massas de Lavoisier e o método científico.,557.7
Natureza,H1,Biologia/Evolução: A teoria da seleção natural de Darwin.,565.8
Natureza,H1,Física: A Teoria da Relatividade de Einstein e sua nova concepção de gravidade.,572.1
Natureza,H1,Física: O experimento de Rutherford e o modelo atômico nuclear.,598.3
Natureza,H1,Química: A organização da Tabela Periódica por Mendeleev.,609.8
Natureza,H1,Química: O papel de Lavoisier na fundação da química moderna.,610.6
Natureza,H1,Biologia: Os experimentos de Pasteur e a refutação da geração espontânea.,617.1
Natureza,H1,Física/Óptica: A controvérsia sobre a natureza da luz (corpuscular x ondulatória).,652.3
Natureza,H1,Química: A descoberta do nêutron por Chadwick.,664.5
