area,habilidade,descricao,tri_score
Natureza,H23,"Física/Termologia: Análise de diferentes processos de transmissão de calor (condução, convecção, irradiação).",515.6
Natureza,H23,Física/Mecânica: Análise de torque e equilíbrio de corpos extensos (alavancas).,518.8
Natureza,H23,"Física/Óptica: Análise de lentes e a formação de imagens (miopia, hipermetropia).",520.3
Natureza,H23,Física/Eletrodinâmica: Análise da Primeira Lei de Ohm em circuitos simples.,524.4
Natureza,H23,Física/Dinâmica: Análise da Terceira Lei de Newton (ação e reação).,526.4
Natureza,H23,Física/Ondulatória: Análise do espectro sonoro e a percepção de diferentes frequências.,533.7
Natureza,H23,Física/Eletricidade: Análise de potência dissipada em resistores (Efeito Joule).,535.0
Natureza,H23,Física/Mecânica: Análise da conservação da energia mecânica em um sistema.,536.2
Natureza,H23,Física/Termodinâmica: Análise da Primeira Lei da Termodinâmica.,537.7
Natureza,H23,Física/Mecânica: Lançamento horizontal e vertical.,542.8
Natureza,H23,Física/Óptica: Análise do fenômeno da dispersão da luz branca em um prisma.,544.7
Natureza,H23,Física/Eletromagnetismo: Análise do campo magnético gerado por um ímã.,549.4
Natureza,H23,Física/Dinâmica: Análise da força centrípeta em movimentos curvos.,550.5
Natureza,H23,Física/Ondulatória: Análise do efeito Doppler para ondas sonoras.,557.7
Natureza,H23,Física/Eletrostática: Análise da força elétrica (Lei de Coulomb).,558.6
Natureza,H23,Física/Mecânica: Análise da conservação da quantidade de movimento.,565.8
Natureza,H23,Física/Hidrostática: Análise do Teorema de Stevin (pressão em líquidos).,567.1
Natureza,H23,Física/Óptica: Análise de espelhos esféricos (côncavos e convexos).,569.7
Natureza,H23,Física/Eletromagnetismo: Análise da Lei de Lenz e da indução eletromagnética.,586.8
Natureza,H23,Física/Dinâmica: Análise de sistemas com polias e roldanas.,588.6
Natureza,H23,Física/Termodinâmica: Análise de máquinas térmicas e o ciclo de Carnot.,598.3
Natureza,H23,Física/Ondulatória: Análise da interferência e difração de ondas.,599.2
Natureza,H23,Física/Eletricidade: Análise de circuitos com capacitores.,609.8
Natureza,H23,Física/Mecânica: Análise do movimento harmônico simples (MHS).,610.6
Natureza,H23,Física/Óptica: Análise da polarização da luz.,611.6
Natureza,H23,Física/Eletromagnetismo: Análise das Equações de Maxwell.,614.0
Natureza,H23,Física/Dinâmica: Análise de colisões elásticas e inelásticas.,617.1
Natureza,H23,Física/Termologia: Análise de gases ideais e a equação de Clapeyron.,621.9
Natureza,H23,Física/Ondulatória: Análise de ondas estacionárias em cordas e tubos sonoros.,622.7
Natureza,H23,Física/Eletricidade: Análise do campo elétrico e potencial elétrico.,627.6
Natureza,H23,Física/Mecânica: Análise de referenciais inerciais e não inerciais.,629.0
Natureza,H23,"Física/Óptica: Análise de instrumentos ópticos (luneta, microscópio).",631.3
Natureza,H23,Física/Eletromagnetismo: Análise da força magnética sobre cargas em movimento.,632.5
Natureza,H23,Física/Dinâmica: Análise de impulso e quantidade de movimento.,638.0
Natureza,H23,Física/Termodinâmica: Análise da Segunda Lei da Termodinâmica e o conceito de entropia.,652.1
Natureza,H23,Física/Ondulatória: Análise da ressonância em sistemas oscilatórios.,652.3
Natureza,H23,Física/Eletricidade: Análise de circuitos com geradores e receptores.,664.5
Natureza,H23,Física/Mecânica: Análise da Lei da Gravitação Universal de Newton.,667.5
Natureza,H23,Física/Óptica: Análise da formação do arco-íris.,674.1
Natureza,H23,Física/Eletromagnetismo: Análise do magnetismo terrestre.,694.7
Natureza,H23,Física/Dinâmica: Análise de forças em planos inclinados.,703.9
Natureza,H23,Física/Termologia: Análise de mudanças de fase e calor latente.,709.3
Natureza,H23,Física/Ondulatória: Análise da natureza dual da luz (onda-partícula).,711.2
Natureza,H23,Física/Eletricidade: Análise de corrente alternada.,711.8
Natureza,H23,Física/Mecânica: Análise de centro de massa.,733.3
Natureza,H23,"Física/Óptica: Análise da visão e defeitos (miopia, hipermetropia).",741.2
Natureza,H23,Física/Eletromagnetismo: Análise de transformadores.,751.2
Natureza,H23,Física/Dinâmica: Análise de movimento de projéteis.,771.9
Natureza,H23,"Física/Termodinâmica: Análise de ciclos termodinâmicos (Otto, Diesel).",780.2
Natureza,H23,Física/Ondulatória: Análise da intensidade sonora e nível sonoro (decibel).,794.2
Natureza,H23,Física/Eletricidade: Análise de Leis de Kirchhoff para circuitos.,812.5
Natureza,H23,Física/Mecânica: Análise de momento angular e sua conservação.,818.4
Natureza,H23,Física/Moderna: Análise do efeito fotoelétrico.,834.1
Natureza,H23,Física/Moderna: Princípios da relatividade especial.,845.9
Natureza,H23,Física/Moderna: Conceito de fissão e fusão nuclear.,851.1
Natureza,H23,Física/Mecânica: Cálculo de momento de inércia.,874.2
Natureza,H23,Física/Mecânica: Análise de gravitação e órbitas.,392.3
Natureza,H23,Física/Eletricidade: Cálculo de energia consumida.,408.0
Natureza,H23,Física/Ondulatória: Qualidades do som.,425.7
Natureza,H23,Física/Termologia: Leis da termodinâmica.,433.4
Natureza,H23,Física/Mecânica: Hidrodinâmica e equação de Bernoulli.,437.3
Natureza,H23,Física/Óptica: Formação de imagens em espelhos curvos.,445.4
Natureza,H23,Física/Eletromagnetismo: Força de Lorentz.,450.9
Natureza,H23,Física/Mecânica: Análise de colisões e coeficiente de restituição.,451.1
Natureza,H23,Física/Termologia: Diagramas de fase.,459.4
Natureza,H23,Física/Ondulatória: Ondas eletromagnéticas e o espectro.,465.0
Natureza,H23,Física/Eletricidade: Circuitos com fontes e resistores.,471.0
Natureza,H23,Física/Mecânica: Equilíbrio de corpos pontuais.,480.2
Natureza,H23,Física/Óptica: Óptica da visão e correção de defeitos.,488.4
Natureza,H23,Física/Eletromagnetismo: Campo elétrico uniforme.,489.6
Natureza,H23,Física/Mecânica: Potência mecânica.,499.5
Natureza,H23,Física/Termodinâmica: Entropia e a segunda lei.,509.9
Natureza,H23,Física/Mecânica: Cálculo do trabalho de uma força.,510.7
Natureza,H24,Química: Reação de combustão do etanol.,408.0
Natureza,H24,"Química: Identificação de hidrocarbonetos (alcanos, alcenos, alcinos).",425.7
Natureza,H24,Química: Conceito de pH e a escala de acidez e basicidade.,430.9
Natureza,H24,"Química: Propriedades físicas da matéria (densidade, ponto de ebulição).",445.4
Natureza,H24,Química: Reações de neutralização ácido-base.,446.8
Natureza,H24,"Química: Identificação de funções oxigenadas (álcool, éter, aldeído, cetona, ácido carboxílico, éster).",450.9
Natureza,H24,"Química: Fatores que afetam a solubilidade (temperatura, pressão).",459.4
Natureza,H24,"Química: Classificação de reações químicas (síntese, análise, simples troca, dupla troca).",465.0
Natureza,H24,Química: Conceito de mol e massa molar.,471.0
Natureza,H24,"Química: Identificação de funções nitrogenadas (amina, amida, nitrocomposto).",473.0
Natureza,H24,"Química: Ligações químicas (iônica, covalente, metálica).",474.8
Natureza,H24,Química: Propriedades dos metais.,476.3
Natureza,H24,"Química: Forças intermoleculares (dipolo-dipolo, ligações de hidrogênio, forças de London).",480.2
Natureza,H24,"Química: Separação de misturas (peneiração, levigação, etc.).",481.2
Natureza,H24,"Química: Classificação de substâncias (simples, compostas) e misturas (homogêneas, heterogêneas).",486.0
Natureza,H24,"Química: Termoquímica, reações exotérmicas e endotérmicas.",487.0
Natureza,H25,Química/Meio Ambiente: O uso de diferentes fontes de energia (renováveis e não renováveis) e seus impactos.,401.1
Natureza,H25,Química: Tratamento de água para consumo.,409.0
Natureza,H25,"Química/Saúde: A química dos alimentos (carboidratos, lipídios, proteínas).",422.3
Natureza,H26,"Química: Aplicação da estequiometria em problemas do cotidiano (ex: receitas, reações industriais).",489.6
Natureza,H26,"Química: Cálculo de concentração de soluções (molaridade, % em massa, ppm).",495.9
Natureza,H27,Química: Análise de reações de combustão e a produção de CO2.,488.4
Natureza,H27,"Química: Análise da polaridade de moléculas e sua relação com a solubilidade (""semelhante dissolve semelhante"").",509.9
Natureza,H27,Química: A química verde e seus princípios.,511.8
Natureza,H25,Química: Cálculo de variação de entalpia (Lei de Hess).,501.4
Natureza,H25,Química: Fatores que influenciam o deslocamento do equilíbrio químico (Princípio de Le Chatelier).,509.9
Natureza,H25,Química: Cálculo de rendimento de reações químicas.,510.7
Natureza,H25,Química: Reconhecimento de reações de oxirredução e cálculo de NOX.,510.8
Natureza,H25,"Química: Propriedades coligativas (pressão de vapor, temperatura de ebulição e congelamento).",511.8
Natureza,H25,Química: Cinética química e a influência da temperatura e catalisadores na velocidade da reação.,515.6
Natureza,H25,Química: Análise de isomeria em compostos orgânicos.,518.8
Natureza,H25,"Química: Eletroquímica, funcionamento de pilhas e cálculo de ddp.",520.3
Natureza,H25,Química: Identificação de polímeros de adição e condensação.,524.4
Natureza,H25,Química: Radioatividade e cálculo de meia-vida.,526.4
Natureza,H25,Química: Equilíbrio iônico e cálculo de pH/pOH.,533.7
Natureza,H25,"Química: Nomenclatura e reações de compostos orgânicos (esterificação, hidrólise).",534.4
Natureza,H25,Química: Análise de solubilidade de sais e produto de solubilidade (Kps).,535.0
Natureza,H25,"Química: Leis ponderais (Lavoisier, Proust) e cálculos estequiométricos.",536.2
Natureza,H25,Química: Eletrólise (ígnea e aquosa).,537.7
Natureza,H25,Química: Termoquímica e cálculo da energia liberada em combustões.,542.8
Natureza,H25,Química: Análise de isomeria óptica e atividade óptica.,544.7
Natureza,H25,Química: Propriedades dos gases e a equação geral dos gases.,549.4
Natureza,H25,Química: Forças intermoleculares e sua relação com o ponto de ebulição.,550.5
Natureza,H25,"Química: Reações orgânicas de substituição, adição e eliminação.",557.7
Natureza,H25,Química: Análise de curvas de titulação.,558.6
Natureza,H25,Química: Cinética química e a teoria das colisões.,565.8
Natureza,H25,Química: Eletroquímica e a série de reatividade dos metais.,567.1
Natureza,H25,Química: Polímeros e suas propriedades (termoplásticos e termorrígidos).,569.7
Natureza,H25,Química: Reações de oxidação em compostos orgânicos (álcoois).,586.8
Natureza,H25,Química: Hidrólise salina e o pH de soluções de sais.,588.6
Natureza,H25,Química: Análise de ligações sigma e pi em moléculas orgânicas.,598.3
Natureza,H25,Química: Termoquímica e a energia de ligação.,599.2
Natureza,H26,Química: Determinação de fórmulas percentual e mínima.,517.7
Natureza,H26,Química: Cálculo de pureza de reagentes.,526.4
Natureza,H26,Química: Estequiometria com reagente em excesso e limitante.,535.0
Natureza,H26,Química: Cálculo de concentração em ppm (partes por milhão).,555.8
Natureza,H26,Química: Diluição e mistura de soluções.,572.1
Natureza,H26,Química: Análise de reações consecutivas em estequiometria.,598.3
Natureza,H26,Química: Titulação e cálculos envolvidos.,610.6
Natureza,H26,Química: Cálculo de pH de soluções-tampão.,627.6
Natureza,H26,Química: Análise da velocidade de reações a partir de gráficos.,631.3
Natureza,H26,Química: Análise da constante de equilíbrio (Kc e Kp).,638.0
Natureza,H26,Química: Cálculos envolvendo a constante de Avogadro.,652.1
Natureza,H26,Química: Estequiometria de gases fora das CNTP.,667.5
Natureza,H26,Química: Análise quantitativa em eletrólise (Leis de Faraday).,694.7
Natureza,H26,Química: Determinação da ordem de uma reação e sua lei de velocidade.,709.3
Natureza,H26,Química: Relação entre termoquímica e cinética (energia de ativação).,733.3
Natureza,H26,Química: Cálculos de propriedades coligativas.,771.9
Natureza,H26,Química: Equilíbrio químico envolvendo gases.,780.2
Natureza,H26,Química: Cálculo de pH em misturas de ácidos e bases.,812.5
Natureza,H26,Química: Análise de mecanismos de reações orgânicas.,834.1
Natureza,H27,Química/Saúde: A química dos protetores solares e a absorção de raios UV.,476.3
Natureza,H27,Química/Meio Ambiente: Análise do ciclo do carbono e o efeito estufa.,486.0
Natureza,H27,Química/Alimentos: O processo de caramelização do açúcar.,495.2
Natureza,H27,Química/Meio Ambiente: O tratamento de efluentes industriais.,510.8
Natureza,H27,Química/Saúde: A ação de medicamentos e o conceito de princípio ativo.,517.7
Natureza,H27,Química/Meio Ambiente: Análise de fontes alternativas de energia (biocombustíveis).,533.7
Natureza,H27,Química/Materiais: Propriedades e aplicações de polímeros.,537.7
Natureza,H27,Química/Meio Ambiente: O problema do descarte de pilhas e baterias.,544.7
Natureza,H27,Química/Saúde: A química dos cosméticos.,557.7
Natureza,H27,Química/Meio Ambiente: A química da poluição da água (metais pesados).,558.6
Natureza,H27,"Química/Alimentos: O uso de aditivos alimentares (conservantes, corantes).",588.6
Natureza,H27,Química/Meio Ambiente: Análise do processo de compostagem.,599.2
Natureza,H27,Química/Saúde: A química da visão e a molécula de retinal.,609.8
Natureza,H27,Química/Meio Ambiente: O uso de defensivos agrícolas (agrotóxicos) e seus impactos.,611.6
Natureza,H27,Química/Materiais: Análise de ligas metálicas e suas propriedades.,617.1
Natureza,H27,Química/Meio Ambiente: A química da camada de ozônio e sua depleção.,629.0
Natureza,H27,Química/Alimentos: A reação de Maillard no cozimento de alimentos.,631.3
Natureza,H27,Química/Saúde: A importância da quiralidade em fármacos.,632.5
Natureza,H27,Química/Meio Ambiente: Análise da chuva ácida e seus efeitos.,664.5
Natureza,H27,Química/Materiais: Propriedades e aplicações de cerâmicas.,674.1
Natureza,H27,Química/Meio Ambiente: Análise da poluição térmica e suas consequências.,711.2
Natureza,H27,Química/Alimentos: O processo de fermentação na produção de pães e bebidas.,751.2
Natureza,H27,Química: Análise de reações nucleares (fissão e fusão).,845.9
Natureza,H28,Biologia/Ecologia: Ciclo do nitrogênio e o papel das bactérias fixadoras.,392.3
Natureza,H28,"Biologia/Saúde: Profilaxia da malária, com foco em evitar a picada do mosquito.",423.1
Natureza,H28,Biologia/Ecologia: Teias alimentares e o fluxo de energia.,432.6
Natureza,H28,Biologia/Saúde: A vacinação e a produção de células de memória (memória imunológica).,437.3
Natureza,H28,"Biologia/Ecologia: Relações ecológicas entre seres vivos (competição, predação, parasitismo).",439.0
Natureza,H28,Biologia/Citologia: Diferenças entre células procarióticas e eucarióticas.,445.4
Natureza,H28,Biologia/Fisiologia: Digestão humana e a ação das enzimas digestivas.,446.8
Natureza,H28,Biologia/Saúde: Ciclo do Aedes aegypti e a prevenção da dengue pela eliminação de criadouros.,450.9
Natureza,H28,"Biologia/Genética: Conceitos básicos (gene, alelo, cromossomo).",451.1
Natureza,H28,Biologia/Ecologia: Ciclo da água.,456.8
Natureza,H28,Biologia/Fisiologia: Sistema respiratório e o processo de trocas gasosas.,459.4
Natureza,H28,Biologia/Saúde: Uso de antibióticos e o problema da seleção e resistência bacteriana.,465.0
Natureza,H28,"Biologia/Ecologia: Biomas e suas características (fauna, flora, clima).",468.7
Natureza,H28,Biologia/Fisiologia: Sistema circulatório e o caminho do sangue no corpo.,471.0
Natureza,H29,"Biologia/Ecologia: Análise de problemas ambientais (desmatamento, poluição) e suas causas.",473.0
Natureza,H29,Biologia/Saúde: A relação entre saneamento básico e a prevenção de verminoses.,474.8
Natureza,H29,Biologia/Ecologia: O papel do desmatamento no agravamento do efeito estufa.,476.3
Natureza,H29,Biologia/Biotecnologia: O uso de transgênicos na agricultura e o debate associado.,481.2
Natureza,H30,"Biologia/Ecologia: Proposição de soluções para a redução do lixo (coleta seletiva, reciclagem).",395.7
Natureza,H30,Biologia/Saúde: Planejamento de ações para controle de endemias (ex: malária).,400.2
Natureza,H30,Biologia/Ecologia: Avaliação de medidas para a conservação da biodiversidade.,403.6
Natureza,H30,Biologia/Biotecnologia: A biorremediação como técnica para despoluição ambiental.,405.9
Natureza,H30,Biologia/Ecologia: Avaliação de fontes de energia renováveis (biomassa) e seus impactos.,417.0
Natureza,H30,Biologia/Saúde: Avaliação de métodos contraceptivos.,425.7
Natureza,H30,Biologia/Ecologia: O uso de controle biológico no combate a pragas agrícolas.,433.4
Natureza,H30,Biologia/Genética: Avaliação das implicações éticas da clonagem.,437.3
Natureza,H30,Biologia/Ecologia: Análise de estratégias para o desenvolvimento sustentável.,446.8
Natureza,H30,Biologia/Saúde: Avaliação da eficácia e segurança de vacinas.,450.9
Natureza,H30,"Biologia/Ecologia: Avaliação de diferentes métodos de tratamento de lixo (aterro, incineração, compostagem).",456.8
Natureza,H30,Biologia/Biotecnologia: Avaliação dos benefícios e riscos da terapia gênica.,465.0
Natureza,H30,Biologia/Ecologia: Avaliação do impacto da introdução de espécies exóticas.,471.0
Natureza,H30,Biologia/Saúde: Avaliação de campanhas de saúde pública para prevenção de doenças.,474.8
Natureza,H30,Biologia/Ecologia: Avaliação de técnicas de manejo agrícola sustentável.,480.2
Natureza,H30,Biologia/Genética: Debate sobre a rotulagem de alimentos transgênicos.,486.0
Natureza,H30,Biologia/Ecologia: Avaliação do impacto da urbanização sobre os ecossistemas.,487.0
Natureza,H30,Biologia/Saúde: Avaliação de políticas públicas de saneamento básico.,495.2
Natureza,H30,Biologia/Ecologia: Avaliação da criação de corredores ecológicos para a fauna.,499.5
Natureza,H30,Biologia/Biotecnologia: Avaliação do uso de células-tronco em pesquisas e tratamentos.,501.4
Natureza,H30,Biologia/Ecologia: Análise crítica da pesca predatória e propostas de manejo.,509.9
Natureza,H30,Biologia/Saúde: Avaliação de programas de controle de vetores de doenças.,510.7
Natureza,H30,Biologia/Ecologia: Análise da sustentabilidade de diferentes matrizes energéticas.,510.8
Natureza,H30,Biologia/Genética: Análise do Projeto Genoma Humano e suas implicações.,515.6
Natureza,H30,Biologia/Ecologia: Análise de soluções para a crise hídrica.,518.8
Natureza,H30,"Biologia/Saúde: Avaliação do impacto do estilo de vida na saúde (sedentarismo, alimentação).",520.3
Natureza,H30,Biologia/Ecologia: Análise da importância da preservação das matas ciliares.,524.4
Natureza,H30,Biologia/Biotecnologia: Avaliação da produção de biocombustíveis e a questão da segurança alimentar.,526.4
Natureza,H30,Biologia/Ecologia: Análise do conceito de pegada ecológica.,533.7
Natureza,H30,Biologia/Saúde: Avaliação do uso indiscriminado de medicamentos.,535.0
Natureza,H30,Biologia/Ecologia: Análise do impacto do turismo em ecossistemas sensíveis.,537.7
Natureza,H30,Biologia/Biotecnologia: Análise do melhoramento genético de plantas e animais.,542.8
Natureza,H30,Biologia/Ecologia: Avaliação de estratégias de consumo consciente.,544.7
Natureza,H30,Biologia/Saúde: Análise da epidemiologia de doenças infecciosas.,549.4
Natureza,H30,Biologia/Ecologia: Análise de projetos de recuperação de áreas degradadas.,550.5
Natureza,H30,Biologia/Genética: Análise crítica do aconselhamento genético.,555.8
Natureza,H30,Biologia/Ecologia: Análise da relação entre desastres ambientais e vulnerabilidade social.,557.7
Natureza,H30,Biologia/Saúde: Avaliação de campanhas antitabagismo.,558.6
Natureza,H30,Biologia/Ecologia: Análise da importância dos manguezais.,565.8
Natureza,H30,Biologia/Biotecnologia: Análise da técnica de transgenia na produção de alimentos.,567.1
Natureza,H30,Biologia/Ecologia: Análise de problemas relacionados ao lixo urbano.,569.7
Natureza,H30,Biologia/Saúde: Análise de surtos e epidemias.,586.8
Natureza,H30,Biologia/Ecologia: Análise do Protocolo de Kyoto e acordos climáticos.,588.6
Natureza,H30,Biologia/Genética: Avaliação da bioética em pesquisas genéticas.,598.3
Natureza,H30,Biologia/Ecologia: Análise do conceito de desenvolvimento sustentável.,599.2
Natureza,H30,Biologia/Saúde: Análise da obesidade como problema de saúde pública.,609.8
Natureza,H30,Biologia/Ecologia: Avaliação do impacto da mineração no meio ambiente.,610.6
Natureza,H30,Biologia/Biotecnologia: Avaliação do uso de agrotóxicos na agricultura.,611.6
Natureza,H30,Biologia/Ecologia: Análise da importância das abelhas como polinizadores.,614.0
Natureza,H30,Biologia/Saúde: Análise da relação entre poluição do ar e doenças respiratórias.,617.1
Natureza,H30,Biologia/Ecologia: Análise do desastre de Mariana e seus impactos.,621.9
Natureza,H30,Biologia/Genética: Análise do diagnóstico pré-natal.,622.7
Natureza,H30,Biologia/Ecologia: Avaliação de alternativas para o descarte de resíduos sólidos.,627.6
Natureza,H30,Biologia/Saúde: Análise do alcoolismo e suas consequências sociais e de saúde.,629.0
Natureza,H30,Biologia/Ecologia: Avaliação da importância da reciclagem.,631.3
Natureza,H30,Biologia/Biotecnologia: Análise da clonagem terapêutica.,632.5
Natureza,H30,Biologia/Ecologia: Análise da poluição dos lençóis freáticos.,638.0
Natureza,H30,Biologia/Saúde: Análise de campanhas de doação de sangue.,652.1
Natureza,H30,Biologia/Ecologia: Análise da eutrofização cultural.,652.3
Natureza,H30,Biologia/Genética: Avaliação de testes de DNA para investigação de crimes.,664.5
Natureza,H30,Biologia/Ecologia: Análise da importância da Amazônia para o equilíbrio climático global.,667.5
Natureza,H30,Biologia/Saúde: Análise da resistência de mosquitos a inseticidas.,674.1
Natureza,H30,Biologia/Ecologia: Avaliação de soluções para a questão do lixo plástico.,694.7
Natureza,H30,Biologia/Biotecnologia: Análise crítica do uso de alimentos transgênicos.,851.1
Natureza,H12,Biologia/Saúde: Doenças endêmicas no Brasil e a importância do saneamento básico para a saúde.,401.9
Natureza,H24,Química: Reação de saponificação (produção de sabão a partir de gordura e base forte).,405.1
Natureza,H24,Química: Conceitos de ácido e base de Arrhenius.,409.0
Natureza,H28,"Biologia/Ecologia: Relação entre desmatamento, perda de habitat e risco de extinção de espécies.",412.5
Natureza,H28,Biologia/Ecologia: Relação de mutualismo entre insetos (abelhas) e plantas com flores.,415.2
Natureza,H8,Biologia/Ecologia: Consequências do descarte de lixo orgânico em aterros controlados.,417.0
Natureza,H28,Biologia/Ecologia: Importância da preservação da diversidade biológica.,422.9
Natureza,H8,Química/Meio Ambiente: Eutrofização de lagos e rios causada pelo excesso de nutrientes.,425.7
Natureza,H12,Biologia/Fisiologia: Ação do pâncreas na produção de enzimas digestivas.,430.9
Natureza,H11,"Biologia/Ecologia: Descarte de lixo e a necessidade de reduzir, reutilizar e reciclar.",441.7
Natureza,H29,Química: Obtenção de etanol a partir da fermentação da sacarose da cana-de-açúcar.,445.4
Natureza,H21,Física/Energia: Transformações de energia em uma usina hidrelétrica.,451.1
Natureza,H28,Biologia/Ecologia: Relação entre o desmatamento da Amazônia e alterações no regime de chuvas.,465.0
Natureza,H28,Biologia/Ecologia: Relação entre a pecuária e a emissão de gases de efeito estufa (metano).,473.0
Natureza,H21,Física/Eletricidade: Cálculo do consumo de energia elétrica de um aparelho (chuveiro).,474.8
Natureza,H20,Física: Procedimento para medir o volume de um objeto irregular pelo deslocamento de líquido.,476.3
Natureza,H26,Química: Identificação de funções orgânicas em um composto (fenol).,477.8
Natureza,H29,Biologia/Ecologia: Relação entre o derretimento de geleiras e o aumento do nível do mar.,480.2
Natureza,H12,Biologia/Saúde: A importância da vacinação em massa para erradicação de doenças.,481.2
Natureza,H11,Biologia/Ecologia: Impactos ambientais da agricultura e a necessidade de práticas sustentáveis.,486.0
Natureza,H17,Química: Diferenças entre fenômenos físicos e químicos.,487.0
Natureza,H21,"Física/Termologia: Processos de transmissão de calor (condução, convecção, irradiação).",488.4
Natureza,H29,"Biologia/Ecologia: A importância dos ""rios voadores"" da Amazônia para o clima da América do Sul.",499.5
Natureza,H28,Biologia/Ecologia: A relação entre o El Niño e as anomalias climáticas.,509.9
Natureza,H17,Física: Análise de grandezas escalares e vetoriais.,511.8
Natureza,H15,Biologia/Saúde: A importância do saneamento básico para a prevenção de doenças como a cólera.,524.4
Natureza,H26,"Química: Relação entre a estrutura da molécula de água, suas pontes de hidrogênio e suas propriedades.",533.7
Natureza,H8,Biologia/Ecologia: Relação entre o uso de combustíveis fósseis e o aumento do efeito estufa.,534.4
Natureza,H13,Biologia/Genética: Conceito de alelos múltiplos no sistema sanguíneo ABO.,537.7
Natureza,H24,Química: Conceito de reações de oxirredução.,542.8
Natureza,H21,Física/Mecânica: Análise de movimento uniforme.,544.7
Natureza,H29,Biologia/Ecologia: A relação entre o tamanho da área e o número de espécies (biodiversidade).,550.5
Natureza,H28,Biologia/Ecologia: Impacto da agricultura na biodiversidade de um ecossistema.,557.7
