area,habilidade,descricao,tri_score
Linguagens,H29,"Hipertexto, mudando a noção de autoria porque o leitor constrói a versão final do texto.",503.8
Linguagens,H16,"Conto ""A Partida"", com o sentimento contraditório expresso na hesitação ""Deveria fugir ou falar com ela?"".",508.8
Linguagens,H12,"Comparação entre pintura (Eckhout) e texto (Caminha), com ambos representando o habitante das terras que sofreriam colonização.",512.6
Linguagens,H3,"Portal Domínio Público, democratizando a informação ao disponibilizar conteúdo cultural e científico.",516.1
Linguagens,H19,"Poema de Manuel Bandeira, com predomínio da função poética pela elaboração especial e artística da estrutura.",534.0
Linguagens,H13,"Representação de grupos musicais, com a figura 1 mostrando um grupo de chorinho.",535.1
Linguagens,H12,"Texto de Bertolt Brecht (""Se os tubarões fossem homens""), questionando a organização das sociedades capitalistas.",542.1
Linguagens,H3,"Texto híbrido (carta e publicidade), com a necessidade de atingir públicos distintos se revelando na estratégia de disponibilização de informações.",550.5
Linguagens,H22,"Comparação de textos sobre a norma da língua, com o primeiro pregando a rigidez e o segundo defendendo a adequação ao padrão atual brasileiro.",567.6
Linguagens,H14,"Teatro do Oprimido, com a linguagem teatral podendo ser democratizada e apropriada pelo cidadão comum para autonomia crítica.",581.6
Linguagens,H17,"Romance regionalista, com o do Nordeste caracterizado pelo realismo, temário local e ponto de vista dos menos favorecidos.",590.6
Linguagens,H25,"Tirinha de Hagar, com a linguagem revelando o caráter coloquial expresso pelo uso do tempo verbal.",591.6
Linguagens,H16,"Figura de linguagem (oximoro), encontrada nos versos ""E me deixa viver / nessa que morre"".",596.9
Linguagens,H23,"Discurso de Marcos Terena, com o ouvinte/leitor pertencendo a um grupo de brasileiros considerados não-índios.",614.1
Linguagens,H15,"Poesia Simbolista (Cruz e Sousa), com o refinamento estético da forma e o tratamento metafísico de temas universais.",616.0
Linguagens,H4,"Anúncio publicitário, com a crítica sobre o uso da linguagem enfatizando a necessidade de dominar as variedades do registro oral para escrever bem.",616.3
Linguagens,H20,"Canção ""Cuitelinho"", mostrando a importância da preservação da produção cultural para a formação da identidade nacional pela tradição oral.",621.8
Linguagens,H11,"Corpolatria, como uma religião pelo avesso, onde a busca da felicidade implica o culto ao prazer.",631.6
Linguagens,H16,"Novela de Raduan Nassar (""Um Copo de Cólera""), evidenciando uma crítica à sociedade por meio de fluxo verbal contínuo e agressivo.",632.1
Linguagens,H21,"Campanha de vacinação, com o emprego de pronomes como ""você"" e ""sua"" e o uso do imperativo para adesão.",636.5
Linguagens,H15,"Novela de Raduan Nassar, com o discurso desmistificador que critica os grandes princípios humanitários.",637.4
Linguagens,H24,"Campanha contra sacolas plásticas, apelando à emoção do leitor ao mencionar a morte de animais.",638.7
Linguagens,H25,"Letra de canção de Lobão, com o autor explorando o extrato sonoro e termos coloquiais em ""lobo-bolo // Tipo pra rimar com ouro de tolo?"".",639.5
Linguagens,H13,"Arte brasileira de origem negro-africana, representada pela obra de Rubem Valentim.",646.1
Linguagens,H28,"Exclusão Digital, como um aprofundamento das diferenças sociais já existentes.",651.9
Linguagens,H27,"Discurso de Marcos Terena, com o uso da norma padrão para situar os interlocutores em posições simétricas.",663.0
Linguagens,H18,"Estruturação do poema de Manuel Bandeira, com destaque para a repetição de sons e de construções sintáticas semelhantes.",668.4
Linguagens,H9,"Balé ""Parade"" (1917), refletindo as inovações tecnológicas nas partes cênicas, musicais e coreográficas.",672.7
Linguagens,H22,"Variação linguística, com os textos convergindo na existência de delimitações dialetais geográficas pouco marcadas no Brasil.",692.0
Linguagens,H17,"Cultura brasileira e ""estilo brasileiro"", com o novo estilo se caracterizando pela união entre as diversas matrizes culturais regionais.",694.1
Linguagens,H4,"Contato entre línguas, com a posição de João de Barros revelando adesão à concepção de língua como entidade homogênea.",703.9
Linguagens,H16,"Poema de Drummond, evidenciando uma tensão histórica entre o ""eu"" e sua comunidade para a constituição do indivíduo.",721.4
Linguagens,H1,"Linguagem de quadrinhos, caracterizada por ser próxima a uma conversação face a face.",726.7
Linguagens,H29,"Linguagem do ""chat"" e suas características na comunicação síncrona.",419.6
Linguagens,H8,"Vacinação de animais para viagens na Europa, representando a diversidade cultural e linguística.",428.1
Linguagens,H10,"Capacidades físicas, identificando a flexibilidade como predominante no movimento de ginástica rítmica.",444.1
Linguagens,H7,Uso de estrangeirismos em texto publicitário para atrair a atenção do público-alvo.,453.3
Linguagens,H21,"Comparação de textos sobre tabagismo, demonstrando que os não fumantes também estão sujeitos às doenças.",454.0
Linguagens,H2,"Análise de gráfico sobre matrículas em cursos universitários, mostrando que mulheres estão em maior percentual em cursos que exigem compreensão humana.",455.8
Linguagens,H30,"Wikipédia como nova tecnologia de informação, questionando a veracidade de seu conteúdo pela construção coletiva.",469.5
Linguagens,H11,"Voleibol, identificando a sequência de movimentos de sacar, defender (manchete) e atacar (cortada).",475.5
Linguagens,H12,Apropriação artística de imagem clássica (Mona Lisa) para compor uma nova obra.,478.0
Linguagens,H19,"Texto de divulgação científica sobre ecossistemas, com predomínio da função referencial da linguagem.",479.2
Linguagens,H19,"Propaganda sobre tecnologia, com o objetivo de influenciar o comportamento do leitor para a adesão ao consumo.",500.5
Linguagens,H24,"Estudo sobre o tráfico de drogas, usando números para comparar os valores pagos pelo crime e pelo governo para comprovar a tese.",506.0
Linguagens,H27,"Carta sobre a prática de futebol por mulheres (1940), elaborada em linguagem culta, adequada ao interlocutor.",518.1
Linguagens,H26,"Variação linguística em charge, com o uso da redução ""tá"" em lugar de ""está"" marcando a informalidade.",522.9
Linguagens,H1,"Comparação de textos sobre o Twitter, com o Texto I exemplificando e explicando o novo serviço de mensagens.",531.1
Linguagens,H4,"Teste de internet (""O que Freud diria de você""), com a autora expressando ironia ao constatar a generalidade do resultado.",534.7
Linguagens,H26,"Neologismo (""corasamborim""), como criação de novo item linguístico.",536.8
Linguagens,H3,"Notícia sobre operação do Ibama, informando sobre uma ação, sua finalidade e resultado.",541.9
Linguagens,H13,"Modernismo (Anita Malfatti), buscando libertar a arte brasileira das normas acadêmicas europeias.",550.0
Linguagens,H3,"Gênero horóscopo, com a função de aconselhar sobre diversos aspectos da vida.",557.4
Linguagens,H14,"Estilo artístico de Salvador Dalí, baseado no onírico, misturando sonho com realidade.",559.2
Linguagens,H6,"Metas de desenvolvimento do milênio (ONU), com os objetivos de promoção da igualdade de gêneros e erradicação da pobreza.",563.5
Linguagens,H23,"Editorial sobre tráfico e juventude, com o objetivo de convencer o leitor sobre a necessidade de repressão policial.",566.8
Linguagens,H23,"Texto sobre transtorno do comer compulsivo, com a finalidade de descrever e fornecer orientações sobre a síndrome.",567.6
Linguagens,H3,"Gênero biografia (Machado de Assis), com apresentação da vida de uma personalidade em ordem narrativa e linguagem objetiva.",569.2
Linguagens,H9,"Dança folclórica, diferenciando-se do balé, que é considerado uma dança-espetáculo.",569.6
Linguagens,H20,"Texto sobre bilinguismo e línguas indígenas, mostrando que elementos de uma língua são preservados mesmo sem falantes.",575.2
Linguagens,H5,"Canção ""Viva la Vida"" (Coldplay), com o eu lírico relatando que costumava ter o mundo aos seus pés e perdeu tudo.",576.5
Linguagens,H28,"Comparação entre o lançamento do livro digital e o acesso à internet no Brasil, mostrando que o projeto esbarra na insuficiência do acesso.",577.9
Linguagens,H7,"Cartão-postal da Antártica, com o propósito de divulgar às pessoas a possibilidade de receber um.",580.1
Linguagens,H15,"Romance sobre as elites do século XIX, mostrando a relação entre fazendeiros e tropeiros como grupos distintos.",592.3
Linguagens,H22,"Debate sobre o Novo Acordo Ortográfico, com o argumento do Ministro da Cultura de Portugal fugindo à discussão central.",597.6
Linguagens,H6,"Publicidade em inglês, com as palavras-chave ""New"", ""Better"" e ""Faster"" referindo-se a empresas concorrentes.",598.5
Linguagens,H15,"Romance ""Clara dos Anjos"", com a rua sendo vista como lugar de exibição pessoal e afirmação de identidade.",598.6
Linguagens,H23,"Texto sobre lixo espacial, com o autor tendo o objetivo de influenciar a opinião do leitor com marcas argumentativas.",600.6
Linguagens,H8,"Diálogo sobre a previsão do tempo, mostrando as diferenças e particularidades culturais no uso de uma língua (inglês).",603.8
Linguagens,H18,"Narração de jogo de futebol, com o conectivo ""mesmo"" trazendo ideia de concessão.",615.3
Linguagens,H18,"Texto literário (""Laços de família""), com o conectivo ""mas"" assumindo funções discursivas distintas nos dois contextos de uso.",620.6
Linguagens,H6,"Bilinguismo no Paraguai, com a valorização do guarani se dando pela inclusão e permanência de seu ensino nas escolas.",631.1
Linguagens,H30,"Evolução dos meios de comunicação, com o texto mostrando que a escrita não fez a palavra desaparecer, mas reorganizou o sistema.",631.4
Linguagens,H17,"Comparação de textos literários (""Capitães da Areia"" e ""35 noites de paixão""), com o espaço onde vivem os personagens sendo uma marca de sua exclusão.",649.6
Linguagens,H29,"Hipertexto, manifestado em textos impressos como dicionários, onde a forma dá liberdade de acesso à informação.",653.1
Linguagens,H25,"Texto sobre variação linguística, com marcas técnicas por meio de expressões próprias de textos científicos.",676.8
Linguagens,H13,"Obra impressionista de Monet, caracterizada pelo uso de pinceladas rápidas de cores puras e dissociadas.",704.1
Linguagens,H5,"Texto sobre tabagismo, com o tema central sendo que fumar ou deixar de fumar engorda.",707.5
Linguagens,H24,"Texto sobre gentileza, com a argumentação mostrando oposição e acrescentando ideias.",711.1
Linguagens,H7,"Bilinguismo no Paraguai, com o autor defendendo que o ensino do guarani não seja uma imposição e criticando o ""continuísmo"".",760.9
Humanas,H1,Filosofia: A concepção de conhecimento em Descartes.,504.2
Humanas,H1,Filosofia: A origem do conhecimento humano segundo David Hume (empirismo).,555.8
Humanas,H1,Filosofia: A concepção de conhecimento em Descartes (autonomia do sujeito pensante).,566.9
Humanas,H1,Filosofia: O epicurismo e a busca pelo prazer moderado como fim.,578.6
Humanas,H1,Filosofia: O método dialético de Sócrates no diálogo com Mênon.,584.8
Humanas,H1,História: A construção da imagem simbólica do rei Luís XIV e o absolutismo.,612.2
Humanas,H1,História da Arte/Cultura: O princípio do Futurismo de superação da história.,614.5
Humanas,H1,Filosofia: A Doutrina das Ideias de Platão e a relação entre razão e sensação.,619.6
Humanas,H1,Sociologia: A sociologia do conhecimento de Karl Mannheim e a influência social no pensamento.,624.0
Humanas,H1,História: A Declaração Balfour e os conflitos territoriais na Palestina.,629.9
Humanas,H1,Filosofia Política: A teoria política de Maquiavel e a distinção entre moral individual e coletiva.,636.2
Humanas,H1,Filosofia: A atividade filosófica segundo Merleau-Ponty (tensão entre saber e ignorância).,647.7
Humanas,H1,Sociologia: A construção da sociologia como ciência por Émile Durkheim.,659.8
Humanas,H1,Filosofia: O pensamento pré-socrático de Empédocles sobre a origem do universo (arché).,666.1
Humanas,H1,Filosofia: A construção da modernidade e o modelo centrado na razão humana.,673.9
Humanas,H1,"Filosofia: A ""revolução copernicana"" de Kant e a natureza do conhecimento.",678.1
Humanas,H1,História do Brasil: Estratégias de resistência escrava no século XIX (anúncio de escravo fugido).,681.1
Humanas,H1,"Filosofia/História da Arte: Interpretação da obra ""A Escola de Atenas"" e o idealismo platônico.",690.5
Humanas,H1,Filosofia: A teoria do conhecimento de David Hume (relação entre pensamento e impressão).,713.1
Humanas,H1,História do Brasil Colonial: Ressignificação cultural na festa da Coroação do Rei do Congo.,716.2
Humanas,H1,Filosofia: O problema do corpo na filosofia cartesiana em contraponto a Merleau-Ponty (dualismo).,763.8
Humanas,H1,Filosofia: A relação entre o sumo bem e a política em Aristóteles.,780.3
Humanas,H1,Filosofia: Reflexão filosófica de Agostinho sobre a eternidade e a criação.,821.5
Humanas,H1,Filosofia Contemporânea: O solipsismo e a questão da realidade externa.,851.8
Humanas,H2,História do Brasil Império: Análise da memória e representação política de D. Pedro I e D. Pedro II.,405.4
Humanas,H2,Cultura Brasileira: Mudanças e permanências culturais na Cavalgada de Sant'Ana (RN).,524.5
Humanas,H2,Geografia: A dimensão simbólica da paisagem e o sentimento de pertencimento.,533.3
Humanas,H2,"História do Brasil: Narrativa sobre a construção de Brasília, articulando política e migração.",548.1
Humanas,H2,História do Brasil: A construção da memória da Inconfidência Mineira na transição para a República.,554.0
Humanas,H2,História do Brasil: A criação do SPHAN e as políticas preservacionistas no Estado Novo.,570.5
Humanas,H2,História do Brasil (Escravidão): A relação entre a ama de leite e os senhores na cultura escravista.,574.1
Humanas,H2,Teoria da História: O papel da biografia e da história do indivíduo como acesso ao cotidiano.,596.0
Humanas,H2,Filosofia: A tradição filosófica existencialista e a reflexão sobre a morte.,607.3
Humanas,H2,Sociologia/Antropologia: O conceito de pobreza em Moçambique relacionado à fragilização das redes de sociabilidade.,615.9
Humanas,H2,História do Brasil Colonial: Política da Coroa portuguesa de supressão da identidade cultural cigana.,618.9
Humanas,H2,Filosofia Medieval: O argumento de Tomás de Aquino para a existência de Deus (fé e razão).,635.3
Humanas,H2,Cultura e Mídia: A representação estereotipada da África em produções cinematográficas.,653.5
Humanas,H2,História do Brasil: A designação etnocêntrica dos povos nativos pelos europeus.,673.7
Humanas,H2,História do Brasil Império: A construção da imagem de D. Pedro II após o Golpe da Maioridade.,674.8
Humanas,H2,História/Geografia Urbana: O papel da memória na construção do espaço público (Praça da Concórdia).,701.6
Humanas,H2,História de São Paulo: A construção de uma memória sobre o bandeirismo no Museu Paulista.,702.4
Humanas,H2,Filosofia (Estoicismo): A filosofia de Sêneca sobre a moderação das paixões.,720.6
Humanas,H3,História da África/Brasil: Formação de uma identidade cultural afro-brasileira a partir da experiência da escravidão.,489.8
Humanas,H3,Cultura Popular: Apropriação de práticas estrangeiras na formação da quadrilha junina no Brasil.,496.2
Humanas,H3,História dos Costumes: O uso do garfo como processo de distinção social na Europa.,511.5
Humanas,H3,Antropologia/Cultura: A formação dos costumes a partir da fusão de elementos de diferentes culturas.,550.2
Humanas,H3,História (Iluminismo): A universalização do princípio da igualdade civil como base para a Declaração dos Direitos do Homem.,557.9
Humanas,H3,História/Cultura Pop: A associação do personagem Capitão América à luta contra regimes totalitários na Segunda Guerra Mundial.,575.2
Humanas,H3,Filosofia Pré-Socrática: O conceito de átomo em Demócrito como princípio constitutivo das coisas.,579.9
Humanas,H3,Filosofia Antiga: O surgimento dos sofistas e o ensino da retórica no contexto da pólis grega.,582.4
Humanas,H3,Sociologia/História do Brasil: A prevalência de interesses privados e vínculos pessoais na vida pública brasileira (Sérgio Buarque de Holanda).,600.1
Humanas,H3,"Cultura Afro-Brasileira: As ""bolsas de mandinga"" como instrumento contra o desamparo social na Colônia.",606.0
Humanas,H3,História da Religião: A apropriação de cerimônias seculares (festa do fogo) pelo cristianismo (festa de São João).,615.7
Humanas,H3,Filosofia (Nietzsche): A alegoria sobre a doutrina niilista e a decadência da cultura.,617.9
Humanas,H3,Cultura Material/Tradição: A produção de panelas de barro em Goiabeiras (ES) e a manutenção dos modos de vida.,636.1
Humanas,H3,Filosofia (Foucault): A constituição do sujeito em interações sociais contingenciais.,648.1
Humanas,H3,Filosofia Pré-Socrática: A caracterização do surgimento da filosofia pela busca racional da causa primeira das coisas.,649.3
Humanas,H3,"Filosofia (Nietzsche): O conceito de ""amor fati"" como crítica à tradição cristã e à valorização do transcendental.",657.8
Humanas,H3,Filosofia/Arte: A percepção (o olhar) como experiência de conhecimento em Merleau-Ponty e Deleuze.,658.0
Humanas,H3,História da Vida Privada: Racionalização do trabalho doméstico e seus impactos nos momentos de socialização das mulheres.,669.3
Humanas,H3,Filosofia (Ceticismo): O ceticismo de Pirro e a defesa da indiferença e impossibilidade de certeza.,672.1
Humanas,H3,História do Carnaval: A transformação das tradições populares em disputas sociais no carnaval do Rio de Janeiro no século XIX.,684.1
Humanas,H3,Filosofia/Literatura: O surgimento do ensaio como gênero literário por Montaigne.,728.5
Humanas,H4,História (Inquisição): O rito do auto de fé como forma de produção de padrões de conduta pela Igreja.,529.1
Humanas,H4,Sociologia/Gênero: A manutenção de estereótipos de gênero na publicidade e na sociedade (comparação 1968 e 2016).,538.9
Humanas,H4,Moda/Cultura Brasileira: A releitura da imagem de Maria Bonita por Zuzu Angel como criação de uma estética de resistência.,540.7
Humanas,H4,Democracia Ateniense: A definição de cidadania em Tucídides e Aristóteles pela participação política.,541.6
Humanas,H4,"Filosofia: Comparação entre a cosmologia racional de Anaxímenes e a teológica de Basílio Magno, ambas postulando um princípio originário para o mundo.",554.2
Humanas,H4,História da Vida Privada (Brasil Império): A representação da mulher submissa na concepção patriarcal de família.,563.5
Humanas,H4,História do Brasil (Cotidiano): A tarefa de carregar lixo no séc. XVIII-XIX como reiteração de hierarquias sociais.,566.4
Humanas,H4,Historiografia/História da América: Divergências sobre o papel das instituições de ensino na fragmentação da América Espanhola e unidade do Brasil.,592.5
Humanas,H4,História Antiga (Grécia e Roma): A criação de normas coletivas (leis) para diminuir as desigualdades de tratamento.,596.7
Humanas,H4,Filosofia (Descartes): O projeto cartesiano e a necessidade de questionar profundamente as antigas concepções para reconstruir o conhecimento.,599.5
Humanas,H4,História do Brasil Colonial: Críticas de cronistas à expropriação de riquezas locais e à mentalidade de levar tudo para Portugal.,601.5
Humanas,H4,Filosofia/Fenomenologia: A valorização do corpo e das sensações na apreensão da realidade (Fernando Pessoa e Merleau-Ponty).,621.1
Humanas,H4,Filosofia Política (Contratualismo): Divergências entre Hobbes e Rousseau sobre a condição original do homem (estado de natureza).,634.3
Humanas,H4,"Guerra de Canudos: Diferentes representações sobre os sertanejos, vistos como fruto da bravura e da loucura.",635.8
Humanas,H4,"Filosofia/Literatura: Crítica de Machado de Assis ao conhecimento superficial, assemelhando-se à utilização persuasiva do discurso dos sofistas.",647.0
Humanas,H4,Filosofia (Descartes): O caráter positivo da dúvida cartesiana para o surgimento do conhecimento inabalável.,673.0
Humanas,H4,"Filosofia (Kant)/Literatura: A releitura poética do pensamento kantiano, invertendo as ideias de interioridade da norma e fenomenalidade do mundo.",681.4
Humanas,H4,"Filosofia/Literatura (Existencialismo): O solilóquio de Hamlet como precursor do existencialismo, enfatizando a tensão entre consciência de si e angústia humana.",693.4
Humanas,H4,Filosofia (Racionalismo vs. Empirismo): Comparação entre Descartes e Hume sobre o papel dos sentidos na obtenção do conhecimento.,701.0
Humanas,H5,História da África/Cultura: A importância da arte pré-histórica africana para a transmissão de saberes acumulados.,508.9
Humanas,H5,Religião/História do Brasil: O uso de santos pela Igreja Católica para cristianizar a população afro-brasileira.,514.9
Humanas,H5,"Civilizações Pré-Colombianas: O legado cultural e de saberes próprios dos Incas, Astecas e Maias.",527.4
Humanas,H5,Patrimônio Histórico/Geopolítica: A destruição de sítios arqueológicos pelo Estado Islâmico como desestruturação do patrimônio histórico.,556.9
Humanas,H5,Patrimônio Cultural: A história de um objeto de museu (tamborete de baiana) associada às habilidades artísticas e culturais das pessoas.,557.5
Humanas,H5,Cultura Regional: A mobilização de práticas místicas associadas ao patrimônio cultural no sertão da Paraíba.,566.1
Humanas,H5,Cultura Afro-Brasileira: A compreensão de manifestações como a capoeira como resultado da interação entre valores africanos e a experiência histórica brasileira.,574.3
Humanas,H5,"Patrimônio Cultural Imaterial: Identificação do ""Ofício das paneleiras de Goiabeiras"" como patrimônio da mesma categoria do queijo de Minas.",582.3
Humanas,H5,Cultura Africana (Povo Woyo): A função de artefatos culturais (tampas de panela) como pedagogia dos costumes sociais.,583.9
Humanas,H5,História Medieval/Arte: O uso de imagens em templos medievais para educar os fiéis através do olhar.,586.7
Humanas,H5,Cultura Indígena (Povo Kambeba): A relação com o rio como um patrimônio cultural e afetivo.,592.6
Humanas,H5,História da África: A importância da cidade de Tombuctu no século XIV devido à sua posição nas redes de circulação e comércio.,597.8
Humanas,H5,Arte Urbana/Grafite: O grafite como apropriação dos espaços públicos e manifestação artística contemporânea.,607.1
Humanas,H5,Cultura Indígena (Nordeste): O ritual do torém como forma de estimular a coesão social.,615.6
Humanas,H5,Formação Cultural Brasileira: Iniciativas como a plataforma Ancestralidades como crítica ao eurocentrismo na história do Brasil.,619.1
Humanas,H5,Movimento dos Direitos Civis (EUA): O ônibus de Rosa Parks como símbolo da deflagração do movimento por igualdade civil.,639.9
Humanas,H5,Patrimônio Imaterial: O ofício da viola de cocho como patrimônio que se identifica como conhecimento tradicional.,644.3
Humanas,H5,Brasil Colônia/Religiosidade: A descrição de uma festa religiosa em Salvador (1717) como afirmação de um sentido comunitário de partilha da devoção.,694.3
Humanas,H5,"Cultura/Museologia: O conflito expresso na imagem ""Nossa cultura não cabe nos seus museus"" decorre da definição dos critérios de criação de acervos.",725.7
Humanas,H5,Patrimônio Mundial (UNESCO): O reconhecimento da paisagem do Rio de Janeiro como patrimônio mundial devido à relação singular entre sociedade e natureza.,775.2
Humanas,H6,Geografia/Cultura: A definição do Sertão em um bordado associada a vivências e itinerários socioafetivos.,519.3
Humanas,H6,Demografia: Análise do gráfico da taxa de fecundidade no Brasil e o fator da participação feminina no mercado de trabalho.,544.0
Humanas,H6,Geografia Física/Clima: A interrupção da sequência de desertos no Brasil devido à umidade das áreas florestais.,546.7
Humanas,H6,Geografia Agrária: Análise do calendário agrícola do agreste como adequação ao tempo da natureza.,555.1
Humanas,H6,Geografia Física/Climatologia: A formação de brisas (marinha e terral) como resultado do aquecimento diferencial da superfície.,563.4
Humanas,H6,Geologia: A possibilidade de um mapa com as divisões políticas atuais na Pangeia dependeria da estabilidade da estrutura geológica.,566.0
Humanas,H6,Geografia Física/Clima: A relação entre o intemperismo de grau muito fraco e o tipo climático semiárido.,588.6
Humanas,H6,Demografia: Comparação de pirâmides etárias urbana e rural no Brasil (1991-2010) indicando menor proporção de fecundidade na área urbana.,590.9
Humanas,H6,Demografia: A diminuição da taxa de fecundidade e sua consequência na redução da oferta de mão de obra nacional.,591.0
Humanas,H6,Geografia Humana: A relação entre a distribuição da população brasileira e a incidência de conflitos em terras indígenas.,607.4
Humanas,H6,Geografia Econômica/Transportes: A expansão das rodovias no Centro-Oeste como resposta à projeção do escoamento da produção do agronegócio.,618.1
Humanas,H6,Geografia Urbana/Migração: O fluxo migratório pendular na Região Metropolitana de Belo Horizonte associado ao processo de conurbação.,621.0
Humanas,H6,Cartografia: A identificação da projeção azimutal no logotipo da ONU.,621.7
Humanas,H6,"Geografia Física/Clima: Análise de climograma para identificar o clima de Moscou, influenciado pela alta latitude.",631.3
Humanas,H6,Cartografia: A identificação da anamorfose geográfica como técnica de representação.,631.3
